{ "version":"v1alpha1", "target":"scores", "timeRange":{"from":"2026-07-01T00:00:00Z","to":"2026-07-08T00:00:00Z"},
  "filters":[ {"field":"name","op":"eq","value":"helpfulness"},
              {"field":"data_type","op":"eq","value":"numeric"} ],
  "groupBy":[ "source" ],
  "aggregations":[ {"op":"avg","field":"value_numeric","alias":"avg"},
                   {"op":"p50","field":"value_numeric","alias":"p50"},
                   {"op":"p90","field":"value_numeric","alias":"p90"},
                   {"op":"count","alias":"n"} ] }
