{ "version":"v1alpha1", "target":"traces", "timeRange":{"from":"2026-07-01T00:00:00Z","to":"2026-07-08T00:00:00Z"},
  "filters":[ {"field":"environment","op":"eq","value":"production"} ],
  "scores":[ {"name":"hallucination","data_type":"numeric","op":"lt","value":0.5,"source":"llm_judge"} ],
  "orderBy":[ {"field":"start_time","dir":"desc"} ], "limit":100 }
