{ "version":"v1alpha1", "target":"spans", "timeRange":{"from":"2026-07-01T00:00:00Z","to":"2026-07-08T00:00:00Z"},
  "filters":[ {"field":"kind","op":"in","value":["generation","embedding"]},
              {"any":[ {"field":"status.code","op":"eq","value":"error"},
                       {"field":"environment","op":"eq","value":"staging"} ]} ],
  "limit":100 }
