{ "version":"v1alpha1", "target":"traces", "timeRange":{"from":"2026-07-01T00:00:00Z","to":"2026-07-08T00:00:00Z"},
  "filters":[ {"field":"user_id","op":"eq","value":"user_42"} ],
  "groupBy":[ "session_id" ],
  "aggregations":[ {"op":"count","alias":"traces"},
                   {"op":"min","field":"start_time","alias":"first_seen"},
                   {"op":"max","field":"start_time","alias":"last_seen"} ] }
