{ "version":"v1alpha1", "target":"spans", "timeRange":{"from":"2026-07-01T00:00:00Z","to":"2026-07-08T00:00:00Z"},
  "filters":[ {"field":"session_id","op":"eq","value":"sess_abc"} ],
  "orderBy":[ {"field":"start_time","dir":"desc"} ], "limit":100,
  "cursor":"eyJzdCI6IjIwMjYtMDctMDVUMTA6MDA6MDBaIiwiaWQiOiIwMGYxIn0=" }
